SKU,Item
IEY1012,Ima Eat You! December 2010
IEY1105,Ima Eat You! May 2011
IEY1106,Ima Eat You! June 2011
IEY1107,Ima Eat You! July 2011
IEY1503,Ima Eat You! March 2015
IEY1504,Ima Eat You! April 2015
IEY1505,Ima Eat You! May 2015
IEY1506,Ima Eat You! June 2015
IEY1507,Ima Eat You! July 2015
IEY1508,Ima Eat You! August 2015
IEY1509,Ima Eat You! September 2015
IEY1510,Ima Eat You! October 2015
IEY1511,Ima Eat You! November 2015
IEY1512,Ima Eat You! December 2015
IEY1601,Ima Eat You! January 2016
SKB001,Ask me about my preferred pronouns
SKS001,Stay Kind! Sticker
SKZ001,Porchin' It
SKZ002,Anthony Poynter
SKB002,Stay Kind! Button
IEY1500,Ima Eat You! 2015 Zine Pack
OPZ001,How to Get Along with Introverts
OPZ002,Notes from a Typewriter: The Politics Issue
OPZ003,Penises Are Confusing: A Special Valentine's Day Edition
OPZ004,Penises Are Confusing: The Jerky Boys
OPZ005,Gimme Gimme: My Relationship with Blow Jobs
OPZ006,Is It Men or Is It Me?
OPZ007,Face Porn
OPZ008,Penises Are Confusing: When to Not Have Sex
OPZ009,Amor Y Sacrificio
OPZ010,Alex Issue 9
OPZ011,Alex Issue 10
OPZ012,Introduction to Gratitude & Self Love
OPZ013,Introduction to Mindfulness & Manifestation
OPZ014,Introduction to Magick
OPZ015,Introduction to Intuition & Clairvoyance
OPZ016,How to Feel Better
OPZ017,Everything is Going To Be Okay
OPZ018,9 Love Potions
OPZ019,Penises Are Confusing Zine Pack
OPZ020,School of Life Design Zine Pack
OPZ021,Confessions
OPZ022,How to See Through Bullshit
OPZ023,"Sometimes, Cigarettes"
OPZ024,Simple Magic
OPZ025,Practicing > Preaching
OPZ026,The List Zine
OPZ027,Dream Life Personal Planner
OPZ028,Mental Hospital Collage Zine
IEY1602,Ima Eat You! February 2016
IEY1603,Ima Eat You! March 2016
IEY1604,Ima Eat You! April 2016
IEY1605,Ima Eat You! May 2016
IEY1606,Ima Eat You! June 2016
IEY1607,Ima Eat You! July 2016
SKP001,Keep On Loving Postcard
OPZ029,The Pen Pal Network News Issue #2
OPZ030,Ang Pangalawang Pagtatapat: The Second Confessions
OPZ031,If you hate someone... YOU HATE SOMEONE
OPZ032,"BiH, A Love Story"
OPZ033,The Goods Zine Vol. 1
OPZ034,The Goods Zine Vol. 2
OPZ035,Send Anything Vol. 1
OPZ036,Drawing Circles
OPZ037,Mailbox Morsels Vol. 1
OPZ038,Pen Pal Network News Issue 3
SKZ003,Parts of the Whole
SKZ004,Confession Issue 1
OPZ039,Send Anything Issue 2
OPZ040,Prayers from Luca Rose
SKS002,Keep On Loving Sticker
OPZ041,A Critique of Ally Politics
OPZ042,How to Put Together Your Own Consent Workshop
OPZ043,Short Guide: Active Listening
OPZ044,Short Guide: Consensus Decision Making
OPZ045,Short Guide: Taking Minutes at Meetings
OPZ046,Just Little Resistance Things
OPZ047,Living Southerners May 2017
OPZ048,Living Southerners December 2017
OPZ049,If you hate someone... 2nd Edition
OPZ050,Rebels: A Star Wars Zine Issue One
OPZ051,All That There Is
OPZ052,Maps In My Mind
SKZ005,Stories from the Inside Issue 1
SKZ006,Confession Issue 2
OPZ053,Fixer Eraser #2
OPZ054,The House Our Gods Destroyed
OPZ055,Kulay Ng Balat: The Third Confessions
OPZ056,Living Southerners May 2018
OPZ057,Living Southerners Variety Pack
OPZ058,Tender Vol. 2
OPZ059,How to Love Me
OPZ060,Fixer Eraser #5
OPZ061,Shrinks: A Retrospective
OPZ062,Tear The Petals Off Of You
OPZ063,Note: All result statuses are Final...
OPZ064,Anxiety Toolkit
OPZ065,Become Worry-Free Right Now
OPZ066,Penises Are Confusing #5: The Burn Inside
OPZ067,Penises Are Confusing #10: Is Oral Sex Dangerous?
OPZ068,Penises Are Confusing #14: Bite?
OPZ069,Penises Are Confusing #19: Vaginas Are Intelligent
OPZ070,Penises Are Confusing #21: Learning Curve
OPZ071,Penises Are Confusing #24: The Jerky Boys (color)
OPZ072,Penises Are Confusing #31: Periods Keep Me Classy
OPZ073,Penises Are Confusing #36: 5th Anniversary
OPZ074,Penises Are Confusing: Too Afraid To Look?
OPZ075,Penises Are Confusing: Blood
OPZ076,Penises Are Confusing: Celebrate Valentine's Day
OPZ077,Penises Are Confusing: A Special Valentine's Day Edition (color)
OPZ078,Penises Are Confusing: When the Penis Stays Soft
SKZ007,1 1/2 Weeks